{
  "canonical_script_id": "01J2ZK3AC9V6XW8YQ4R5T6U7ZLC",
  "created_at": "2026-07-21T08:00:00Z",
  "glossary_id": "01J2ZK3AC9V6XW8YQ4R5T6U7ZLG",
  "id": "01J2ZK3AC9V6XW8YQ4R5T6U7ZLV",
  "provider": "tra.fake",
  "schema_version": "1",
  "sentences": [
    {
      "canonical_sentence_id": "cs-0",
      "claim_ids": [
        "c-hook-0"
      ],
      "claim_source_status": "VERIFIED",
      "duration_estimate_ms": 3200,
      "id": "ls-0",
      "needs_review": false,
      "review_reasons": [],
      "schema_version": "1",
      "semantic_similarity": 0.92,
      "target_language": "en-US",
      "text": "This on-device model runs in just 2 GB of RAM.",
      "tra_result_id": null
    },
    {
      "canonical_sentence_id": "cs-1",
      "claim_ids": [
        "c-evidence-0"
      ],
      "claim_source_status": "VERIFIED",
      "duration_estimate_ms": 5000,
      "id": "ls-1",
      "needs_review": false,
      "review_reasons": [],
      "schema_version": "1",
      "semantic_similarity": 0.94,
      "target_language": "en-US",
      "text": "Inference clocks in at 20 ms — 40% lower than last gen.",
      "tra_result_id": null
    }
  ],
  "target_language": "en-US",
  "total_duration_estimate_ms": 8200
}
